{"blind_role_exclusion_required":true,"completion_status":"incomplete","errors":[],"form_id":"semantic-prescreen-portable-blank-form-v1","h1_assigned":false,"h2_assigned":false,"necessity_assigned":false,"plan_id":"semantic-prescreen-portable-blank-plan-v1","prescreener_exposure_required":true,"readiness_token":"SEMANTIC_AV_SOURCE_PRESCREEN_REPAIR","record_type":"semantic_av_source_prescreen_import","schema_version":"1.0.0","source_results":[{"authoring_eligibility":"repair","blind_finder_eligible":false,"candidate_fact_count":0,"concrete_non_speech_audio_event_count":0,"dynamic_visual_event_count":0,"errors":["FORM_NOT_COMPLETED"],"exposure_recorded":false,"readiness_token":"SEMANTIC_AV_SOURCE_PRESCREEN_REPAIR","sample_count":3,"saturation_auditor_eligible":false,"source_group_id":"portable-source-group-a","source_id":"portable-source-a","speech_present_sample_count":0},{"authoring_eligibility":"repair","blind_finder_eligible":false,"candidate_fact_count":0,"concrete_non_speech_audio_event_count":0,"dynamic_visual_event_count":0,"errors":["FORM_NOT_COMPLETED"],"exposure_recorded":false,"readiness_token":"SEMANTIC_AV_SOURCE_PRESCREEN_REPAIR","sample_count":3,"saturation_auditor_eligible":false,"source_group_id":"portable-source-group-b","source_id":"portable-source-b","speech_present_sample_count":0}]}
